{
  "schema_version": "2.0.0",
  "provider": "supabase",
  "product": "orioledb",
  "workload": "tpcc",
  "scenario": "cache-exceeding-xlarge",
  "tier": "xlarge",
  "bound_type": "cache-exceeding",
  "variant": null,
  "instance": {
    "instance_type": "xlarge",
    "vcpu": 4,
    "ram_gb": 16,
    "disk_gb": 128,
    "iops": 12000,
    "throughput_mbps": 149,
    "disk_type": "gp3",
    "cpu_arch": "aarch64",
    "engine_version": "PostgreSQL 17.11 on aarch64-unknown-linux-gnu, compiled by gcc (GCC) 15.2.0, 64-bit",
    "pg_settings": "checkpoint_completion_target=0.9, effective_cache_size=1572864, max_connections=240, max_wal_size=4096, shared_buffers=204800, synchronous_commit=on, work_mem=16384",
    "orioledb_version": "OrioleDB beta 17"
  },
  "measured_from": "2026-09-25T19:40:53Z",
  "measured_to": "2026-09-26T17:06:31Z",
  "reproducibility": {
    "benchctl_version": "0.1.0+20260926-226809c",
    "dbarenactl_version": "dev+20261001-9484226",
    "load_generator": {
      "name": "https://github.com/supabase/go-tpc/",
      "version": "latest-SNAPSHOT-f4fce76"
    },
    "command": "dbarenactl run --candidate candidates/supabase/orioledb/tpcc/manifest.yaml --test-point xlarge/cache-exceeding"
  },
  "pricing": {
    "monthly_usd": 468.28,
    "hours_per_month": 730,
    "pricing_model": "on-demand-list-price",
    "fetched_at": "2026-09-28T13:20:26Z",
    "components": [
      {
        "name": "pro_plan_base_fee",
        "amount_usd": 25,
        "detail": "sku=plan-pro $25.000/month"
      },
      {
        "name": "compute",
        "amount_usd": 210,
        "detail": "sku=XL project_size=xlarge $210.000/month"
      },
      {
        "name": "disk_size_overage",
        "amount_usd": 15,
        "detail": "sku=disk-gp3-size included=8 GB provisioned=128 overage=120 rate=$0.125000/GB-mo = $15.000"
      },
      {
        "name": "disk_iops_overage",
        "amount_usd": 216,
        "detail": "sku=disk-gp3-iops included=3000 IOPS provisioned=12000 overage=9000 rate=$0.024000/IOPS-mo = $216.000"
      },
      {
        "name": "disk_throughput_overage",
        "amount_usd": 2.28,
        "detail": "sku=disk-gp3-throughput included=125 MB/s provisioned=149 overage=24 rate=$0.095000/MBps-mo = $2.280"
      }
    ]
  },
  "sweep": [
    {
      "concurrency": 4,
      "peak": false,
      "workload_parameters": {
        "warehouses": 640
      },
      "iterations": [
        {
          "iteration": 1,
          "median": false,
          "started_at": "2026-09-25T19:40:53Z",
          "completed_at": "2026-09-26T04:12:43Z",
          "tpm_per_dollar_month": 18.04,
          "workload_metrics": {
            "transactions": {
              "DELIVERY": {
                "count": 45170,
                "tpm": 753,
                "latency_ms": {
                  "p50": 24.12,
                  "p90": 26.74,
                  "p95": 27.26,
                  "p99": 28.84,
                  "p99_9": 36.7,
                  "avg": 24.26,
                  "max": 49.81
                }
              },
              "NEW_ORDER": {
                "count": 506874,
                "tpm": 8448,
                "latency_ms": {
                  "p50": 16.25,
                  "p90": 20.97,
                  "p95": 22.02,
                  "p99": 23.59,
                  "p99_9": 26.21,
                  "avg": 16.1,
                  "max": 38.8
                }
              },
              "ORDER_STATUS": {
                "count": 44976,
                "tpm": 750,
                "latency_ms": {
                  "p50": 6.29,
                  "p90": 7.86,
                  "p95": 8.91,
                  "p99": 11.01,
                  "p99_9": 16.78,
                  "avg": 6.04,
                  "max": 36.7
                }
              },
              "PAYMENT": {
                "count": 485110,
                "tpm": 8085,
                "latency_ms": {
                  "p50": 7.34,
                  "p90": 8.39,
                  "p95": 8.91,
                  "p99": 9.44,
                  "p99_9": 11.53,
                  "avg": 7.21,
                  "max": 42.47
                }
              },
              "STOCK_LEVEL": {
                "count": 44664,
                "tpm": 744,
                "latency_ms": {
                  "p50": 33.03,
                  "p90": 54,
                  "p95": 60.29,
                  "p99": 72.88,
                  "p99_9": 86.51,
                  "avg": 30.58,
                  "max": 102.76
                }
              }
            }
          },
          "metadata": {
            "db_size_after": {
              "total_bytes": 73792976139
            },
            "db_size_before": {
              "total_bytes": 74019443159
            },
            "driver_cpu_utilization": {
              "0.99": 0.1062,
              "0.999": 0.1102,
              "0.9999": 0.1103
            },
            "driver_network_throughput_bytes_per_sec": {
              "receive": {
                "0.99": 1348370,
                "0.999": 1374746,
                "0.9999": 1380228
              },
              "transmit": {
                "0.99": 33643229,
                "0.999": 33978354,
                "0.9999": 34021787
              }
            },
            "network_rtt": {
              "max_us": 469,
              "median_us": 447,
              "min_us": 439,
              "p99_us": 464,
              "samples": 200
            },
            "orioledb_version": "OrioleDB beta 17",
            "pg_settings": {
              "checkpoint_completion_target": 0.9,
              "effective_cache_size": 1572864,
              "max_connections": 240,
              "max_wal_size": 4096,
              "shared_buffers": 204800,
              "synchronous_commit": "on",
              "work_mem": 16384
            },
            "pg_version": "PostgreSQL 17.11 on aarch64-unknown-linux-gnu, compiled by gcc (GCC) 15.2.0, 64-bit",
            "wal_size_after": {
              "wal_bytes": 55186399320
            },
            "wal_size_before": {
              "wal_bytes": 51625902486
            }
          },
          "raw_metrics_file": "raw-clients-4-iteration-1.csv"
        },
        {
          "iteration": 2,
          "median": false,
          "started_at": "2026-09-26T04:12:44Z",
          "completed_at": "2026-09-26T12:46:54Z",
          "tpm_per_dollar_month": 14.92,
          "workload_metrics": {
            "transactions": {
              "DELIVERY": {
                "count": 37707,
                "tpm": 628,
                "latency_ms": {
                  "p50": 28.84,
                  "p90": 31.98,
                  "p95": 32.51,
                  "p99": 34.08,
                  "p99_9": 41.94,
                  "avg": 28.95,
                  "max": 56.1
                }
              },
              "NEW_ORDER": {
                "count": 419290,
                "tpm": 6988,
                "latency_ms": {
                  "p50": 19.92,
                  "p90": 25.17,
                  "p95": 26.74,
                  "p99": 28.84,
                  "p99_9": 30.93,
                  "avg": 19.71,
                  "max": 46.14
                }
              },
              "ORDER_STATUS": {
                "count": 37213,
                "tpm": 620,
                "latency_ms": {
                  "p50": 6.82,
                  "p90": 8.91,
                  "p95": 9.96,
                  "p99": 12.58,
                  "p99_9": 21.5,
                  "avg": 6.95,
                  "max": 39.85
                }
              },
              "PAYMENT": {
                "count": 399082,
                "tpm": 6651,
                "latency_ms": {
                  "p50": 8.91,
                  "p90": 10.49,
                  "p95": 11.01,
                  "p99": 11.53,
                  "p99_9": 13.11,
                  "avg": 8.87,
                  "max": 33.03
                }
              },
              "STOCK_LEVEL": {
                "count": 37269,
                "tpm": 621,
                "latency_ms": {
                  "p50": 35.65,
                  "p90": 58.2,
                  "p95": 65.01,
                  "p99": 77.07,
                  "p99_9": 90.18,
                  "avg": 33.36,
                  "max": 108.53
                }
              }
            }
          },
          "metadata": {
            "db_size_after": {
              "total_bytes": 73256934225
            },
            "db_size_before": {
              "total_bytes": 73540255097
            },
            "driver_cpu_utilization": {
              "0.99": 0.1093,
              "0.999": 0.1136,
              "0.9999": 0.1149
            },
            "driver_network_throughput_bytes_per_sec": {
              "receive": {
                "0.99": 1188463,
                "0.999": 1414345,
                "0.9999": 1414889
              },
              "transmit": {
                "0.99": 33624125,
                "0.999": 34126253,
                "0.9999": 34203446
              }
            },
            "network_rtt": {
              "max_us": 586,
              "median_us": 552,
              "min_us": 542,
              "p99_us": 575,
              "samples": 200
            },
            "orioledb_version": "OrioleDB beta 17",
            "pg_settings": {
              "checkpoint_completion_target": 0.9,
              "effective_cache_size": 1572864,
              "max_connections": 240,
              "max_wal_size": 4096,
              "shared_buffers": 204800,
              "synchronous_commit": "on",
              "work_mem": 16384
            },
            "pg_version": "PostgreSQL 17.11 on aarch64-unknown-linux-gnu, compiled by gcc (GCC) 15.2.0, 64-bit",
            "wal_size_after": {
              "wal_bytes": 54376197620
            },
            "wal_size_before": {